{
  "contract_version": "authority-registry-snapshot/0.1.0-draft",
  "registry_id": "example-calendar-registry",
  "snapshot_id": "example-snapshot-2099-01-v1",
  "snapshot_version": 1,
  "supersedes_snapshot_id": null,
  "supersedes_snapshot_artifact_sha256": null,
  "scope": {
    "run_id": "2099-01-r99",
    "consumer_id": "calendar-renderer",
    "programme_month": "2099-01",
    "registry_purpose": "calendar-authority-resolution"
  },
  "entries": [
    {
      "entry_type": "eligibility-decision",
      "logical_id": "example-eligibility-2099-01-001-v1",
      "artifact_sha256": "93e555bb187eae91f1c79c4668e8a20b88355317a1df807b8d03a54717478d85",
      "authority_purpose": "calendar-eligibility",
      "artifact_status": "accepted"
    },
    {
      "entry_type": "eligibility-decision",
      "logical_id": "example-eligibility-2099-01-002-v1",
      "artifact_sha256": "159a91c3abe294157a4526e832d41f38ea0e82d5c5bfa95673e64eefac2d89c7",
      "authority_purpose": "calendar-eligibility",
      "artifact_status": "accepted"
    },
    {
      "entry_type": "monthly-selection",
      "logical_id": "example-selection-2099-01-v1",
      "artifact_sha256": "96e8ccbd24e5bcdccf2e553f75148e365b961af92e6cd98dfe09e5afb6aac763",
      "authority_purpose": "calendar-monthly-selection",
      "artifact_status": "accepted"
    }
  ],
  "snapshot_subject_sha256": "ca116e96ffab5326be710cf95b2033749986da8bbe60900282d53f84a61929f2",
  "publication_authority_reference": {
    "authority_id": "example-registry-publication-authority-001",
    "authority_purpose": "calendar-registry-publication"
  },
  "publication_authority_artifact_sha256": "6b8989f0555edd15a14543de07149c4269053da5519709ebde39a098b22f3518",
  "published_at": "2099-01-04T10:00:00Z"
}
